{
  "schema_version": "1.0",
  "review_id": "llm_review_demo_unavailable",
  "request_id": "llm_request_demo_unavailable",
  "correlation_id": "session_2026-07-20",
  "causation_id": null,
  "session_id": "session_2026-07-20",
  "occurred_at_utc": "2026-07-20T12:00:00Z",
  "received_at_utc": "2026-07-20T12:00:01Z",
  "source": "llm-intelligence-layer",
  "source_sequence": 0,
  "rule_version": "rules_p3_1.0.0",
  "stage": "PRE_MARKET",
  "trading_date": "2026-07-20",
  "plan_id": null,
  "plan_hash": null,
  "review_status": "UNAVAILABLE",
  "summary": "",
  "decision_support": "LLM review unavailable; deterministic trading flow remains unchanged.",
  "sop_alignment": "Unknown",
  "risk_notes": [],
  "invalidations": [],
  "recommended_action": "Review Only",
  "confidence": 0,
  "rule_references": [],
  "evidence_citations": [],
  "daily_review": null,
  "rule_hypotheses": [],
  "unavailable_reason_code": "TIMEOUT",
  "provider": {
    "provider": "deepseek-openai",
    "model": "deepseek-v4-flash",
    "provider_request_id": null,
    "prompt_version": "phase4-review-v3",
    "input_hash": "cccccccccccccccccccccccccccccccccccccccccccccccccccccccccccccccc",
    "latency_ms": 5000,
    "attempts": 2,
    "cache_hit": false,
    "input_tokens": 0,
    "output_tokens": 0,
    "estimated_cost_usd": "0"
  },
  "source_refs": []
}
