{
  "schema_version": "1.0",
  "review_id": "llm_review_demo_001",
  "request_id": "llm_request_demo_001",
  "correlation_id": "plan_demo_001",
  "causation_id": "risk_plan_demo_001",
  "session_id": "session_2026-07-20",
  "occurred_at_utc": "2026-07-20T14:30:02Z",
  "received_at_utc": "2026-07-20T14:30:03Z",
  "source": "llm-intelligence-layer",
  "source_sequence": 1,
  "rule_version": "rules_p3_1.0.0",
  "stage": "PRE_EXECUTION",
  "trading_date": "2026-07-20",
  "plan_id": "plan_demo_001",
  "plan_hash": "aaaaaaaaaaaaaaaaaaaaaaaaaaaaaaaaaaaaaaaaaaaaaaaaaaaaaaaaaaaaaaaa",
  "review_status": "COMPLETED",
  "summary": "候选计划与已记录剧本一致，但最终下单仍由 Rust Final Risk Check 决定。",
  "decision_support": "结构化快照未显示 SOP 冲突。",
  "sop_alignment": "Aligned",
  "risk_notes": ["临近到期，Gamma 与滑点风险较高。"],
  "invalidations": ["事件窗口或行情健康状态变化。"],
  "recommended_action": "Proceed",
  "confidence": 0.78,
  "rule_references": ["SOP-ENTRY-01"],
  "evidence_citations": [{ "source_id": "plan_demo_001", "claim": "计划要求人工确认。" }],
  "daily_review": null,
  "rule_hypotheses": [],
  "unavailable_reason_code": null,
  "provider": {
    "provider": "deepseek-openai",
    "model": "deepseek-v4-flash",
    "provider_request_id": "provider-demo-001",
    "prompt_version": "phase4-review-v3",
    "input_hash": "bbbbbbbbbbbbbbbbbbbbbbbbbbbbbbbbbbbbbbbbbbbbbbbbbbbbbbbbbbbbbbbb",
    "latency_ms": 420,
    "attempts": 1,
    "cache_hit": false,
    "input_tokens": 800,
    "output_tokens": 180,
    "estimated_cost_usd": "0.0001624"
  },
  "source_refs": [{
    "source_id": "plan_demo_001",
    "source_type": "candidate_trade_plan",
    "source": "application-service",
    "occurred_at_utc": "2026-07-20T14:30:00Z",
    "raw_ref": "postgresql://trading/candidate_trade_plans/plan_demo_001",
    "confidence": 1.0
  }]
}
